{
  "schemaVersion": 1,
  "voicePackVersion": "1.0.0",
  "engine": {
    "name": "supertonic",
    "packageVersion": "1.3.1",
    "model": "supertonic-3",
    "language": "ko",
    "sampleRate": 44100,
    "defaultSpeed": 1.05
  },
  "aliases": {
    "F1": "female-01",
    "F2": "female-02",
    "F3": "female-03",
    "F4": "female-04",
    "F5": "female-05"
  },
  "nativeVoices": ["F1", "F2", "F3", "F4", "F5", "M1", "M2", "M3", "M4", "M5"],
  "baseStyleSha256": {
    "F1": "bbdec6ee00231c2c742ad05483df5334cab3b52fda3ba38e6a07059c4563dbc2",
    "F2": "7c722c6a72707b1a77f035d67f0d1351ba187738e06f7683e8c72b1df3477fc6",
    "F3": "12f6ef2573baa2defa1128069cb59f203e3ab67c92af77b42df8a0e3a2f7c6ab",
    "F4": "c2fa764c1225a76dfc3e2c73e8aa4f70d9ee48793860eb34c295fff01c2e032b",
    "F5": "45966e73316415626cf41a7d1c6f3b4c70dbc1ba2bee5c1978ef0ce33244fc8d"
  },
  "aiDisclosure": "이 콘텐츠의 내레이션은 Supertonic AI 합성 음성으로 제작되었습니다.",
  "license": {
    "model": "OpenRAIL-M",
    "url": "https://huggingface.co/Supertone/supertonic-3/blob/main/LICENSE",
    "aiDisclosureRequired": true
  },
  "voices": [
    {
      "id": "female-01",
      "displayName": "여성 01 · F1",
      "badge": "범용 추천",
      "kind": "builtin",
      "components": {"F1": 1.0},
      "recommendedSpeed": 1.1,
      "pitch": "중간",
      "pace": "여유",
      "pitchHz": 199,
      "summary": "따뜻하고 부드러운 균형형. 강조가 과하지 않아 오래 듣기 편합니다.",
      "useCases": ["일반 내레이션", "교육", "설명 영상"],
      "recommendedSkills": ["brush-video"],
      "preview": {"path": "assets/voices/previews/female-01.mp3", "sha256": "2887608000fa13a13345257b8d455141513992c76361ca12357c700aaf29c907", "durationSec": 10.0, "codec": "mp3", "sampleRate": 44100, "channels": 1, "peakDbfs": -4.8847, "activeRmsDbfs": -20.1736, "clippedSamples": 0}
    },
    {
      "id": "female-02",
      "displayName": "여성 02 · F2",
      "badge": "가장 밝음",
      "kind": "builtin",
      "components": {"F2": 1.0},
      "recommendedSpeed": 1.1,
      "pitch": "매우 높음",
      "pace": "빠름",
      "pitchHz": 238,
      "summary": "밝고 생동감 있으며 억양 변화가 가장 큰 활기찬 목소리입니다.",
      "useCases": ["쇼츠", "홍보", "밝은 교육 콘텐츠"],
      "recommendedSkills": ["shorts-brush"],
      "preview": {"path": "assets/voices/previews/female-02.mp3", "sha256": "3473efcb02ae8ba5d6a30437478d4206bd63084db10900c4156595dc898af13b", "durationSec": 10.0, "codec": "mp3", "sampleRate": 44100, "channels": 1, "peakDbfs": -5.272, "activeRmsDbfs": -20.4037, "clippedSamples": 0}
    },
    {
      "id": "female-03",
      "displayName": "여성 03 · F3",
      "badge": "공기감",
      "kind": "builtin",
      "components": {"F3": 1.0},
      "recommendedSpeed": 1.1,
      "pitch": "낮음",
      "pace": "가장 느림",
      "pitchHz": 176,
      "summary": "낮은 기본음에 고역과 공기감이 강해 섬세하고 차분하게 들립니다.",
      "useCases": ["감성 내레이션", "다큐", "차분한 이야기"],
      "recommendedSkills": ["dark-random-brush-video"],
      "preview": {"path": "assets/voices/previews/female-03.mp3", "sha256": "b6f7469ecfa8c78fc039327c68b209c9b9ede01732c68607fa61c7f2d011a548", "durationSec": 10.0, "codec": "mp3", "sampleRate": 44100, "channels": 1, "peakDbfs": -3.4977, "activeRmsDbfs": -20.1409, "clippedSamples": 0}
    },
    {
      "id": "female-04",
      "displayName": "여성 04 · F4",
      "badge": "가장 빠름",
      "kind": "builtin",
      "components": {"F4": 1.0},
      "recommendedSpeed": 1.1,
      "pitch": "중고음",
      "pace": "매우 빠름",
      "pitchHz": 205,
      "summary": "군더더기 없이 또렷하고 빠르게 핵심을 전달하는 목소리입니다.",
      "useCases": ["정보 요약", "튜토리얼", "빠른 쇼츠"],
      "recommendedSkills": ["pen-video", "shorts-brush"],
      "preview": {"path": "assets/voices/previews/female-04.mp3", "sha256": "c923546ae155d96a26fa9de70ac7310e91f08e230d2d7cebcd7799e3744b9a69", "durationSec": 10.0, "codec": "mp3", "sampleRate": 44100, "channels": 1, "peakDbfs": -5.6985, "activeRmsDbfs": -20.1404, "clippedSamples": 0}
    },
    {
      "id": "female-05",
      "displayName": "여성 05 · F5",
      "badge": "가장 안정적",
      "kind": "builtin",
      "components": {"F5": 1.0},
      "recommendedSpeed": 1.1,
      "pitch": "가장 낮음",
      "pace": "보통",
      "pitchHz": 170,
      "summary": "낮고 포근하며 억양 변화가 적어 안정감과 편안함이 큽니다.",
      "useCases": ["명상", "힐링", "수면", "잔잔한 동화"],
      "recommendedSkills": ["brush-video", "storybook-full-touch-video"],
      "preview": {"path": "assets/voices/previews/female-05.mp3", "sha256": "76895c091b69baf95f4b8290952e151b3e99fce2bf5aecf06a5f167556f05868", "durationSec": 10.0, "codec": "mp3", "sampleRate": 44100, "channels": 1, "peakDbfs": -8.2884, "activeRmsDbfs": -20.1415, "clippedSamples": 0}
    },
    {
      "id": "female-06",
      "displayName": "여성 06 · F1+F3",
      "badge": "장편 추천",
      "kind": "blend",
      "components": {"F1": 0.65, "F3": 0.35},
      "recommendedSpeed": 1.1,
      "pitch": "중저음",
      "pace": "느림",
      "pitchHz": 182,
      "summary": "F1의 따뜻함과 F3의 차분함을 결합해 편안하면서도 표현력이 살아 있습니다.",
      "useCases": ["장편 교육", "다큐", "안정적인 해설"],
      "recommendedSkills": ["brush-video"],
      "preview": {"path": "assets/voices/previews/female-06.mp3", "sha256": "043229ca5c62bcbad7755e447d4a42fada28bc57be575bb2ca27de7d9f8d18e4", "durationSec": 10.0, "codec": "mp3", "sampleRate": 44100, "channels": 1, "peakDbfs": -7.11, "activeRmsDbfs": -20.2439, "clippedSamples": 0}
    },
    {
      "id": "female-07",
      "displayName": "여성 07 · F2+F4",
      "badge": "쇼츠 추천",
      "kind": "blend",
      "components": {"F2": 0.6, "F4": 0.4},
      "recommendedSpeed": 1.1,
      "pitch": "높음",
      "pace": "매우 빠름",
      "pitchHz": 211,
      "summary": "밝은 음역과 빠른 전달력을 결합한 또렷하고 활기찬 목소리입니다.",
      "useCases": ["쇼츠", "제품 소개", "핵심 정보 전달"],
      "recommendedSkills": ["shorts-brush"],
      "preview": {"path": "assets/voices/previews/female-07.mp3", "sha256": "18c66819edca6600e2b778bb571cfd6e725a803bc9865dcbe3b0ab530e29fec5", "durationSec": 10.0, "codec": "mp3", "sampleRate": 44100, "channels": 1, "peakDbfs": -5.6877, "activeRmsDbfs": -20.2483, "clippedSamples": 0}
    },
    {
      "id": "female-08",
      "displayName": "여성 08 · F3+F5",
      "badge": "동화 추천",
      "kind": "blend",
      "components": {"F3": 0.5, "F5": 0.5},
      "recommendedSpeed": 1.1,
      "pitch": "낮음",
      "pace": "느림",
      "pitchHz": 172,
      "summary": "낮고 부드러우면서 공기감이 있어 감성적이고 시적인 분위기가 납니다.",
      "useCases": ["동화", "감성 에세이", "힐링 영상"],
      "recommendedSkills": ["storybook-full-touch-video"],
      "preview": {"path": "assets/voices/previews/female-08.mp3", "sha256": "8d844b22880f1dacd62ce43e4a986b626fafc77ab4ffd72ca919e518b684514a", "durationSec": 10.0, "codec": "mp3", "sampleRate": 44100, "channels": 1, "peakDbfs": -4.5083, "activeRmsDbfs": -20.1806, "clippedSamples": 0}
    },
    {
      "id": "female-09",
      "displayName": "여성 09 · F4+F1",
      "badge": "전문 해설",
      "kind": "blend",
      "components": {"F4": 0.65, "F1": 0.35},
      "recommendedSpeed": 1.1,
      "pitch": "중간",
      "pace": "매우 빠름",
      "pitchHz": 197,
      "summary": "빠르지만 과하게 밝지 않은 중립적 톤으로 신뢰감과 전달력이 좋습니다.",
      "useCases": ["전문 설명", "가이드", "기업·교육 영상"],
      "recommendedSkills": ["pen-video", "pen-brush-video"],
      "preview": {"path": "assets/voices/previews/female-09.mp3", "sha256": "e90c1bb3f264976bec202961da7d8234a1cd58a4914ec99ff6f777295a13e110", "durationSec": 10.0, "codec": "mp3", "sampleRate": 44100, "channels": 1, "peakDbfs": -2.4865, "activeRmsDbfs": -20.1804, "clippedSamples": 0}
    },
    {
      "id": "female-10",
      "displayName": "여성 10 · F5+F2",
      "badge": "강조형",
      "kind": "blend",
      "components": {"F5": 0.6, "F2": 0.4},
      "recommendedSpeed": 1.1,
      "pitch": "낮음",
      "pace": "빠름",
      "pitchHz": 171,
      "summary": "낮고 따뜻한 기본 톤에 밝은 억양과 큰 강약 변화가 더해졌습니다.",
      "useCases": ["스토리텔링", "강조형 장편 내레이션", "생활 콘텐츠"],
      "recommendedSkills": ["brush-video"],
      "preview": {"path": "assets/voices/previews/female-10.mp3", "sha256": "638a724f1cadab5c13ad436ab165a9dabe7c0cb1f5f47502caec9343b9788f39", "durationSec": 10.0, "codec": "mp3", "sampleRate": 44100, "channels": 1, "peakDbfs": -7.2242, "activeRmsDbfs": -20.2266, "clippedSamples": 0}
    }
  ]
}
